{
  "template_id": "coilmaster_dx_lh_hgbp",
  "schema_version": "template-first.1",
  "source_policy": [
    "reviewed_canonical_value",
    "ez_json_evidence",
    "source_pdf_candidate",
    "manual_reviewed_value",
    "blocked_or_review_required"
  ],
  "slots": [
    {
      "slot_id": "slot.BF",
      "label": "BF",
      "required_for_preview": true,
      "review_status": "review_required",
      "source_candidates": [
        "pdf_drawing_value_redacted_to_slot"
      ],
      "notes": "Seeded from the provided EZ drawing PDF; review required."
    },
    {
      "slot_id": "slot.CASING_MATERIAL",
      "label": "CASING_MATERIAL",
      "required_for_preview": false,
      "review_status": "review_required",
      "source_candidates": [
        "pdf_drawing_value_redacted_to_slot"
      ],
      "notes": "Seeded from the provided EZ drawing PDF; review required."
    },
    {
      "slot_id": "slot.CD",
      "label": "CD",
      "required_for_preview": true,
      "review_status": "review_required",
      "source_candidates": [
        "pdf_drawing_value_redacted_to_slot"
      ],
      "notes": "Seeded from the provided EZ drawing PDF; review required."
    },
    {
      "slot_id": "slot.CH",
      "label": "CH",
      "required_for_preview": true,
      "review_status": "review_required",
      "source_candidates": [
        "pdf_drawing_value_redacted_to_slot"
      ],
      "notes": "Seeded from the provided EZ drawing PDF; review required."
    },
    {
      "slot_id": "slot.CIRCUITING",
      "label": "CIRCUITING",
      "required_for_preview": false,
      "review_status": "review_required",
      "source_candidates": [
        "pdf_drawing_value_redacted_to_slot"
      ],
      "notes": "Seeded from the provided EZ drawing PDF; review required."
    },
    {
      "slot_id": "slot.CL",
      "label": "CL",
      "required_for_preview": true,
      "review_status": "review_required",
      "source_candidates": [
        "pdf_drawing_value_redacted_to_slot"
      ],
      "notes": "Seeded from the provided EZ drawing PDF; review required."
    },
    {
      "slot_id": "slot.COIL_TUBE_FACE",
      "label": "COIL_TUBE_FACE",
      "required_for_preview": false,
      "review_status": "review_required",
      "source_candidates": [
        "pdf_drawing_value_redacted_to_slot"
      ],
      "notes": "Seeded from the provided EZ drawing PDF; review required."
    },
    {
      "slot_id": "slot.DISTRIBUTORS",
      "label": "DISTRIBUTORS",
      "required_for_preview": false,
      "review_status": "review_required",
      "source_candidates": [
        "pdf_drawing_value_redacted_to_slot"
      ],
      "notes": "Seeded from the provided EZ drawing PDF; review required."
    },
    {
      "slot_id": "slot.FH",
      "label": "FH",
      "required_for_preview": true,
      "review_status": "review_required",
      "source_candidates": [
        "pdf_drawing_value_redacted_to_slot"
      ],
      "notes": "Seeded from the provided EZ drawing PDF; review required."
    },
    {
      "slot_id": "slot.FIN_MATERIAL",
      "label": "FIN_MATERIAL",
      "required_for_preview": false,
      "review_status": "review_required",
      "source_candidates": [
        "pdf_drawing_value_redacted_to_slot"
      ],
      "notes": "Seeded from the provided EZ drawing PDF; review required."
    },
    {
      "slot_id": "slot.FL",
      "label": "FL",
      "required_for_preview": true,
      "review_status": "review_required",
      "source_candidates": [
        "pdf_drawing_value_redacted_to_slot"
      ],
      "notes": "Seeded from the provided EZ drawing PDF; review required."
    },
    {
      "slot_id": "slot.HD2",
      "label": "HD2",
      "required_for_preview": true,
      "review_status": "review_required",
      "source_candidates": [
        "pdf_drawing_value_redacted_to_slot"
      ],
      "notes": "Seeded from the provided EZ drawing PDF; review required."
    },
    {
      "slot_id": "slot.HDx1",
      "label": "HDx1",
      "required_for_preview": true,
      "review_status": "review_required",
      "source_candidates": [
        "pdf_drawing_value_redacted_to_slot"
      ],
      "notes": "Seeded from the provided EZ drawing PDF; review required."
    },
    {
      "slot_id": "slot.HEADER_MATERIAL",
      "label": "HEADER_MATERIAL",
      "required_for_preview": false,
      "review_status": "review_required",
      "source_candidates": [
        "pdf_drawing_value_redacted_to_slot"
      ],
      "notes": "Seeded from the provided EZ drawing PDF; review required."
    },
    {
      "slot_id": "slot.HF",
      "label": "HF",
      "required_for_preview": false,
      "review_status": "review_required",
      "source_candidates": [
        "pdf_drawing_value_redacted_to_slot"
      ],
      "notes": "Seeded from the provided EZ drawing PDF; review required."
    },
    {
      "slot_id": "slot.I1",
      "label": "I1",
      "required_for_preview": false,
      "review_status": "review_required",
      "source_candidates": [
        "pdf_drawing_value_redacted_to_slot"
      ],
      "notes": "Seeded from the provided EZ drawing PDF; review required."
    },
    {
      "slot_id": "slot.MODEL_NUMBER",
      "label": "MODEL_NUMBER",
      "required_for_preview": true,
      "review_status": "review_required",
      "source_candidates": [
        "pdf_drawing_value_redacted_to_slot"
      ],
      "notes": "Seeded from the provided EZ drawing PDF; review required."
    },
    {
      "slot_id": "slot.O2",
      "label": "O2",
      "required_for_preview": false,
      "review_status": "review_required",
      "source_candidates": [
        "pdf_drawing_value_redacted_to_slot"
      ],
      "notes": "Seeded from the provided EZ drawing PDF; review required."
    },
    {
      "slot_id": "slot.OAL",
      "label": "OAL",
      "required_for_preview": false,
      "review_status": "review_required",
      "source_candidates": [
        "pdf_drawing_value_redacted_to_slot"
      ],
      "notes": "Seeded from the provided EZ drawing PDF; review required."
    },
    {
      "slot_id": "slot.R2",
      "label": "R2",
      "required_for_preview": false,
      "review_status": "review_required",
      "source_candidates": [
        "pdf_drawing_value_redacted_to_slot"
      ],
      "notes": "Seeded from the provided EZ drawing PDF; review required."
    },
    {
      "slot_id": "slot.RB",
      "label": "RB",
      "required_for_preview": false,
      "review_status": "review_required",
      "source_candidates": [
        "pdf_drawing_value_redacted_to_slot"
      ],
      "notes": "Seeded from the provided EZ drawing PDF; review required."
    },
    {
      "slot_id": "slot.RETURN_CONN_SIZE",
      "label": "RETURN_CONN_SIZE",
      "required_for_preview": false,
      "review_status": "review_required",
      "source_candidates": [
        "pdf_drawing_value_redacted_to_slot"
      ],
      "notes": "Seeded from the provided EZ drawing PDF; review required."
    },
    {
      "slot_id": "slot.RF",
      "label": "RF",
      "required_for_preview": false,
      "review_status": "review_required",
      "source_candidates": [
        "pdf_drawing_value_redacted_to_slot"
      ],
      "notes": "Seeded from the provided EZ drawing PDF; review required."
    },
    {
      "slot_id": "slot.ROWS",
      "label": "ROWS",
      "required_for_preview": true,
      "review_status": "review_required",
      "source_candidates": [
        "pdf_drawing_value_redacted_to_slot"
      ],
      "notes": "Seeded from the provided EZ drawing PDF; review required."
    },
    {
      "slot_id": "slot.S1",
      "label": "S1",
      "required_for_preview": false,
      "review_status": "review_required",
      "source_candidates": [
        "pdf_drawing_value_redacted_to_slot"
      ],
      "notes": "Seeded from the provided EZ drawing PDF; review required."
    },
    {
      "slot_id": "slot.SL2",
      "label": "SL2",
      "required_for_preview": false,
      "review_status": "review_required",
      "source_candidates": [
        "pdf_drawing_value_redacted_to_slot"
      ],
      "notes": "Seeded from the provided EZ drawing PDF; review required."
    },
    {
      "slot_id": "slot.TAG",
      "label": "TAG",
      "required_for_preview": true,
      "review_status": "review_required",
      "source_candidates": [
        "pdf_drawing_value_redacted_to_slot"
      ],
      "notes": "Seeded from the provided EZ drawing PDF; review required."
    },
    {
      "slot_id": "slot.TF",
      "label": "TF",
      "required_for_preview": true,
      "review_status": "review_required",
      "source_candidates": [
        "pdf_drawing_value_redacted_to_slot"
      ],
      "notes": "Seeded from the provided EZ drawing PDF; review required."
    },
    {
      "slot_id": "slot.TUBE_MATERIAL",
      "label": "TUBE_MATERIAL",
      "required_for_preview": false,
      "review_status": "review_required",
      "source_candidates": [
        "pdf_drawing_value_redacted_to_slot"
      ],
      "notes": "Seeded from the provided EZ drawing PDF; review required."
    }
  ]
}