{
  "template_id": "coilmaster_dx_lh_header1",
  "schema_version": "template-first.1",
  "source_policy": [
    "reviewed_canonical_value",
    "ez_json_evidence",
    "source_pdf_candidate",
    "manual_reviewed_value",
    "blocked_or_review_required"
  ],
  "slots": [
    {"slot_id": "slot.FH", "label": "FH", "required_for_preview": true, "review_status": "review_required", "source_candidates": ["Geometry.FH", "source_pdf.page6.Fin Height"], "notes": "Iteration 001 confirmed pair value."},
    {"slot_id": "slot.FL", "label": "FL", "required_for_preview": true, "review_status": "review_required", "source_candidates": ["Geometry.FL", "source_pdf.page6.Fin Length"], "notes": "Iteration 001 confirmed pair value."},
    {"slot_id": "slot.CH", "label": "CH", "required_for_preview": true, "review_status": "review_required", "source_candidates": ["Geometry.CH"], "notes": "EZ JSON evidence."},
    {"slot_id": "slot.CL", "label": "CL", "required_for_preview": true, "review_status": "review_required", "source_candidates": ["Geometry.CL"], "notes": "EZ JSON evidence."},
    {"slot_id": "slot.CD", "label": "CD", "required_for_preview": true, "review_status": "review_required", "source_candidates": ["Geometry.CD"], "notes": "EZ JSON evidence."},
    {"slot_id": "slot.TF", "label": "TF", "required_for_preview": true, "review_status": "review_required", "source_candidates": ["Geometry.TSP"], "notes": "EZ JSON evidence."},
    {"slot_id": "slot.BF", "label": "BF", "required_for_preview": true, "review_status": "review_required", "source_candidates": ["Geometry.BSP"], "notes": "EZ JSON evidence."},
    {"slot_id": "slot.HF", "label": "HF", "required_for_preview": false, "review_status": "review_required", "source_candidates": ["Geometry.LEP"], "notes": "Meaning requires review."},
    {"slot_id": "slot.RF", "label": "RF", "required_for_preview": false, "review_status": "review_required", "source_candidates": ["Geometry.REP"], "notes": "Meaning requires review."},
    {"slot_id": "slot.RB", "label": "RB", "required_for_preview": false, "review_status": "review_required", "source_candidates": ["Geometry.RB"], "notes": "EZ JSON evidence."},
    {"slot_id": "slot.OAL", "label": "OAL", "required_for_preview": false, "review_status": "observed_candidate_review_required", "source_candidates": ["Geometry.CL + Geometry.RB2"], "notes": "Not an approved formula."},
    {"slot_id": "slot.HDx1", "label": "HDx1", "required_for_preview": true, "review_status": "review_required", "source_candidates": ["Geometry.Headers[0].HD"], "notes": "DX distributor header suffix."},
    {"slot_id": "slot.HD2", "label": "HD2", "required_for_preview": true, "review_status": "review_required", "source_candidates": ["Geometry.Headers[1].HD"], "notes": "Return header suffix."},
    {"slot_id": "slot.SL2", "label": "SL2", "required_for_preview": false, "review_status": "review_required", "source_candidates": ["Geometry.Headers[1].SL[0]"], "notes": "Return stub length."},
    {"slot_id": "slot.I1", "label": "I1", "required_for_preview": false, "review_status": "review_required", "source_candidates": ["Geometry.Headers[0].IO[0]"], "notes": "Supply/distributor offset."},
    {"slot_id": "slot.S1", "label": "S1", "required_for_preview": false, "review_status": "review_required", "source_candidates": ["Geometry.Headers[0].SR"], "notes": "Supply/distributor spacing."},
    {"slot_id": "slot.O2", "label": "O2", "required_for_preview": false, "review_status": "review_required", "source_candidates": ["Geometry.Headers[1].IO[0]"], "notes": "Return offset."},
    {"slot_id": "slot.R2", "label": "R2", "required_for_preview": false, "review_status": "review_required", "source_candidates": ["Geometry.Headers[1].SR"], "notes": "Return spacing."},
    {"slot_id": "slot.ROWS", "label": "ROWS", "required_for_preview": true, "review_status": "review_required", "source_candidates": ["Inputs.Nrows", "Geometry.Nrows"], "notes": "Iteration 001 confirmed pair value."},
    {"slot_id": "slot.TAG", "label": "Tag", "required_for_preview": true, "review_status": "review_required", "source_candidates": ["drawing.title.Tag", "source_pdf.cover.Tag"], "notes": "Title block."},
    {"slot_id": "slot.MODEL_NUMBER", "label": "Model Number", "required_for_preview": true, "review_status": "review_required", "source_candidates": ["drawing.title.model_number"], "notes": "Hand suffix requires review."},
    {"slot_id": "slot.NOTES", "label": "Notes", "required_for_preview": false, "review_status": "review_required", "source_candidates": ["drawing.notes"], "notes": "Source-backed or reviewed text only."},
    {"slot_id": "slot.TUBE_MATERIAL", "label": "Tube Material", "required_for_preview": false, "review_status": "review_required", "source_candidates": ["source_pdf.page6.Tube Material", "drawing.right_panel.TUBE_MATERIAL"], "notes": "Vocabulary formatting requires review."},
    {"slot_id": "slot.FIN_MATERIAL", "label": "Fin Material", "required_for_preview": false, "review_status": "review_required", "source_candidates": ["source_pdf.page6.Fin Material", "drawing.right_panel.FIN_MATERIAL"], "notes": "Vocabulary formatting requires review."},
    {"slot_id": "slot.CASING_MATERIAL", "label": "Casing Material", "required_for_preview": false, "review_status": "review_required", "source_candidates": ["drawing.right_panel.CASING_MATERIAL"], "notes": "May depend on EZ defaults."},
    {"slot_id": "slot.COIL_TUBE_FACE", "label": "Coil Tube Face", "required_for_preview": false, "review_status": "review_required", "source_candidates": ["Geometry.FH", "drawing.right_panel.COIL_TUBE_FACE"], "notes": "Needs review before generalizing."},
    {"slot_id": "slot.CIRCUITING", "label": "Circuiting", "required_for_preview": false, "review_status": "review_required", "source_candidates": ["Geometry.MultiCircuitCoilFeeds", "Geometry.MultiCircuitCoilPasses"], "notes": "Pluralization and multi-circuit formats need more pairs."},
    {"slot_id": "slot.HEADER_MATERIAL", "label": "Header Material", "required_for_preview": false, "review_status": "review_required", "source_candidates": ["drawing.right_panel.HEADER_MATERIAL"], "notes": "May depend on EZ defaults."},
    {"slot_id": "slot.DISTRIBUTORS", "label": "Distributors", "required_for_preview": false, "review_status": "review_required", "source_candidates": ["Geometry.Distributors", "Geometry.Headers[0].DistributorModelNumber"], "notes": "ASC/HGBP display requires review."},
    {"slot_id": "slot.RETURN_CONN_SIZE", "label": "Return Connection Size", "required_for_preview": false, "review_status": "review_required", "source_candidates": ["Geometry.ReturnConnectionsSize", "source_pdf.page6.Suction Size"], "notes": "Source-backed candidate."},
    {"slot_id": "slot.CALLOUT_1", "label": "Callout 1", "required_for_preview": false, "review_status": "review_required", "source_candidates": ["drawing.callouts[0]"], "notes": "Source-backed drawing callout."},
    {"slot_id": "slot.CALLOUT_2", "label": "Callout 2", "required_for_preview": false, "review_status": "review_required", "source_candidates": ["drawing.callouts[1]"], "notes": "Source-backed drawing callout."},
    {"slot_id": "slot.CALLOUT_3", "label": "Callout 3", "required_for_preview": false, "review_status": "review_required", "source_candidates": ["drawing.callouts[2]"], "notes": "Source-backed drawing callout."},
    {"slot_id": "slot.CALLOUT_4", "label": "Callout 4", "required_for_preview": false, "review_status": "review_required", "source_candidates": ["drawing.callouts[3]"], "notes": "Source-backed drawing callout."}
  ]
}
